{
  "protocol": "asterion.agent-client/v1",
  "event_id": "event-1",
  "session_id": "session-1",
  "generation": 1,
  "sequence": 1,
  "emitted_at": "2026-08-10T15:00:00Z",
  "type": "message.available",
  "payload": {
    "content_ref": "private-message-1",
    "media_type": "text/plain",
    "message_id": "message-1",
    "role": "assistant",
    "sha256": "aaaaaaaaaaaaaaaaaaaaaaaaaaaaaaaaaaaaaaaaaaaaaaaaaaaaaaaaaaaaaaaa",
    "size": 13
  }
}
